sentence,label
Is there a specific formula or method for calculating the remaining carried-over leave days post-forfeiture?,2059
Can you provide information on how to determine the remaining brought forward leave days once forfeiture is considered?,2059
"What happens to the total number of carried-over leave days after some are forfeited, and how can I calculate the remaining days?",2059
Are there any guidelines for calculating the remaining brought forward leave days after a forfeiture of days?,2059
How can I figure out the precise number of brought forward leave days I'll have left after forfeiting a specific amount?,2059
What is the maximum limit for the total number of leave days I can carry forward after accounting for forfeiture?,2059
Can you explain the process for determining the remaining carried-over leave days in the event of forfeiture?,2059
What is the impact of forfeiting leave days on the calculation of remaining brought forward days?,2059
Is there a standard procedure for calculating the remaining brought forward leave days following forfeiture?,2059
How do I calculate the remaining carried-over leave days when a forfeiture occurs?,2059
Can you clarify how the forfeiture of leave days affects the calculation of remaining brought forward days?,2059
Are there any specific rules or guidelines for calculating the remaining brought forward leave days after forfeiture is applied?,2059
Can you provide insight into how the forfeiture of leave days is factored into the calculation of remaining carried-over leave days?,2059
What is the policy regarding calculating the remaining brought forward leave days post-forfeiture?,2059
Is there a defined process for determining the remaining carried-over leave days after a forfeiture event?,2059
Can you help me understand the impact of forfeiture on the total number of carried-over leave days and how to calculate the remaining days?,2059
How many brought forward leave days will I have left after forfeiting a portion?,2059
Can you calculate the remaining carried-over leave days after taking into account the forfeiture of some days?,2059
What will be my total carried-over leave balance once I consider the forfeiture?,2059
Is there a method to determine the precise number of brought-forward leave days I'll retain after forfeiting some?,2059
How many leave days can I carry forward after the forfeiture?,2059
What happens to my carried-over leave balance if I forfeit a certain number of days?,2059
Can you help me calculate the remaining leave balance I'll have after forfeiting some days?,2059
What's the policy for calculating the leave balance available to be brought forward after a forfeiture?,2059
How does forfeiting leave days affect the total carried-over leave balance?,2059
What's the procedure for determining the remaining leave balance after a specified forfeiture?,2059
How many brought forward will be left after forfeiture?,2059
"If I forfeit 5 days of my brought forward leave, how many days will be left?",2059
Can you help me calculate the remaining brought forward leave days once forfeiture is taken into account?,2059
What will be the total number of carried-over leave days left for me after accounting for the potential forfeiture of some days?,2059
Is there a way to determine the exact number of brought forward leave days I will retain after forfeiture?,2059
How many leave days can be brought forward after forfeiture?,2059
Can you assist me in calculating the remaining brought-forward leave days after factoring in the forfeiture?,2059
What will be the total number of carried-over leave days remaining for me once I consider the potential forfeiture of some days?,2059
Is there a method to determine the precise number of brought-forward leave days I'll retain after forfeiture?,2059
How many leave days can I carry forward in total after forfeiture?,2059
How many days of brought forward leave will I have left if I forfeit a portion of it?,2059
Can you calculate the remaining carried-over leave days after taking into account the forfeiture of a specific number of days?,2059
What's the formula or method to determine the remaining brought forward leave days post-forfeiture?,2059
"If I decide to forfeit 5 days of my carried-over leave, how many days will I retain?",2059
Is there a way to find out the exact number of brought forward leave days I'll have after forfeiting some of them?,2059
What's the maximum limit for the total number of leave days I can carry forward after forfeiture?,2059
Can you help me understand how many carried-over leave days I'll have left after forfeiting a certain number of days?,2059
Is there a specific calculation or policy for determining the remaining brought forward leave after forfeiture?,2059
How does the forfeiture of leave days affect the total number of days I can carry forward?,2059
Can you clarify the process for calculating the remaining brought forward leave days in case of forfeiture?,2059
What's the procedure for determining the remaining brought forward leave days after some days are forfeited?,2059
Can you guide me on how to calculate the carried-over leave days that will be left following a forfeiture?,2059
How does the forfeiture of leave days impact the total number of brought forward days I can retain?,2059
What is the policy for calculating the remaining brought forward leave days after a specified forfeiture?,2059
Is there a specific formula or method for calculating the remaining carried-over leave days post-forfeiture?,2059
Can you provide information on how to determine the remaining brought forward leave days once forfeiture is considered?,2059
"What happens to the total number of carried-over leave days after some are forfeited, and how can I calculate the remaining days?",2059
Are there any guidelines for calculating the remaining brought forward leave days after a forfeiture of days?,2059
How can I figure out the precise number of brought forward leave days I'll have left after forfeiting a specific amount?,2059
What is the maximum limit for the total number of leave days I can carry forward after accounting for forfeiture?,2059
Can you explain the process for determining the remaining carried-over leave days in the event of forfeiture?,2059
What is the impact of forfeiting leave days on the calculation of remaining brought forward days?,2059
Is there a standard procedure for calculating the remaining brought forward leave days following forfeiture?,2059
How do I calculate the remaining carried-over leave days when a forfeiture occurs?,2059
Can you clarify how the forfeiture of leave days affects the calculation of remaining brought forward days?,2059
Are there any specific rules or guidelines for calculating the remaining brought forward leave days after forfeiture is applied?,2059
Can you provide insight into how the forfeiture of leave days is factored into the calculation of remaining carried-over leave days?,2059
What is the policy regarding calculating the remaining brought forward leave days post-forfeiture?,2059
Is there a defined process for determining the remaining carried-over leave days after a forfeiture event?,2059
Can you help me understand the impact of forfeiture on the total number of carried-over leave days and how to calculate the remaining days?,2059
How many brought forward leave days will I have left after forfeiting a portion?,2059
Can you calculate the remaining carried-over leave days after taking into account the forfeiture of some days?,2059
What will be my total carried-over leave balance once I consider the forfeiture?,2059
Is there a method to determine the precise number of brought-forward leave days I'll retain after forfeiting some?,2059
How many leave days can I carry forward after the forfeiture?,2059
What happens to my carried-over leave balance if I forfeit a certain number of days?,2059
Can you help me calculate the remaining leave balance I'll have after forfeiting some days?,2059
What's the policy for calculating the leave balance available to be brought forward after a forfeiture?,2059
How does forfeiting leave days affect the total carried-over leave balance?,2059
What's the procedure for determining the remaining leave balance after a specified forfeiture?,2059
Is my leave approved?,2060
May I know whether my applied leave is approved?,2060
Could you please tell me the status of my leave request?,2060
Is there a way for me to find out whether my applied leave has been approved or not?,2060
Can you help me check the status of my leave application and see if it has been approved?,2060
How to check application status?,2060
My leave approval status?,2060
What is the status of my leave application?,2060
Where can I check my leave application status?,2060
My leave application status?,2060
What is the status of my applied sick leave?,2060
Where to view the status of my leave application?,2060
Can you confirm whether my leave has been approved?,2060
Is there a way to check the status of my applied leave?,2060
Please let me know the status of my leave application.,2060
What is my leave status?,2060
What is my status of leave?,2060
Could you provide information about the approval status of my leave application?,2060
How do I check if my leave has been approved?,2060
What is the current status of my leave application?,2060
Can you inform me if my sick leave has been approved?,2060
Where can I view the status of my leave application?,2060
Can you check and confirm if my leave request has been approved?,2060
Can you tell me if my leave request is approved?,2060
Has my applied leave been approved by the company?,2060
How can I verify the approval status of my leave application?,2060
What is the current status of my applied leave?,2060
Please check and confirm whether my leave has been approved or not.,2060
Is there a way to find out if my leave application is approved?,2060
Can you provide me with information about the approval status of my leave request?,2060
Where can I check the status of my leave application to see if it's been approved?,2060
Could you inform me of the status of my applied sick leave?,2060
What is the status of my leave application? Has it been approved?,2060
I'd like to know the status of my leave application. Can you help me with that?,2060
How do I check if my leave request has been approved?,2060
Can I confirm if my leave application was approved?,2060
How can I find out if my leave has been approved?,2060
Where can I see the status of my leave approval?,2060
Is there a way to verify if my leave was approved?,2060
How do I know if my leave has been approved?,2060
Can you tell me how to confirm my leave approval status?,2060
How can I check the approval status of my leave request?,2060
How do I ensure that my leave has been approved?,2060
What steps can I take to verify my leave approval?,2060
Can you check the status of my leave application and tell me if it's been approved?,2060
Why is my leave balance in negative value?,2061
Why is my leave balance showing a negative value in the system?,2061
Can you help me understand why I have a negative leave balance on my record?,2061
"Is there a reason why my leave balance is in the negative, and how can I rectify this?",2061
I'm curious about the cause of the negative leave balance. Can you provide more information or assistance in resolving this issue?,2061
Why is my leave balance showing negative?,2061
What does it mean if my leave balance is showing a negative value?,2061
What could be the reason for my leave balance displaying a negative value?,2061
Can you explain why my leave balance in the system is negative?,2061
I'm trying to understand why there is a negative balance in my leave record. Can you provide some insights?,2061
Can you clarify why my leave balance is in the negative?,2061
What might have caused my leave balance to go into the negative?,2061
"Why does my leave balance show a negative value, and how can I resolve this issue?",2061
"Is there a way to correct my negative leave balance, and what caused it in the first place?",2061
"Can you shed light on the reasons behind my negative leave balance, and what steps can I take to address it?",2061
What actions can I take to rectify my negative leave balance in the system?,2061
"Is there a specific reason why my leave balance has become negative, and what can be done to fix it?",2061
How can I resolve the negative value displayed in my leave balance?,2061
"Can you provide insights into why my leave balance is negative, and how can I correct it?",2061
What should I do if my leave balance is showing a negative value in the system?,2061
What steps should I take to address a negative leave balance in the system?,2061
How can I rectify a negative leave balance on my record?,2061
"Is there a procedure for correcting a negative leave balance, and can you guide me through it?",2061
"Why am I seeing a negative balance in my leave record, and what can I do to fix it?",2061
"Can you explain how negative leave balances occur, and what actions can I take to resolve them?",2061
What is the process for adjusting a negative leave balance in the system?,2061
"Is there a way to clear a negative leave balance, and if so, what is the recommended procedure?",2061
Can you provide information on how to reconcile a negative leave balance on my record?,2061
"Why does my leave balance sometimes show as negative, and what steps are necessary to correct it?",2061
How can I ensure that my leave balance remains positive and doesn't go into the negative?,2061
"What are the common causes of negative leave balances, and how can they be prevented?",2061
"Is it possible to have a negative leave balance due to system errors, and what should I do in such cases?",2061
Can you guide me on how to investigate the reasons behind a negative leave balance?,2061
Are there policies or rules in place that determine when a leave balance can go negative?,2061
How frequently should I check my leave balance to avoid it going into the negative?,2061
What can be done to avoid or minimize the occurrence of negative leave balances in the system?,2061
Can you explain the consequences of having a negative leave balance and how it impacts my leave entitlement?,2061
Are there specific situations or scenarios that may lead to a negative leave balance?,2061
"Can a negative leave balance affect my eligibility for future leave requests, and if so, how?",2061
Can you provide guidance on maintaining a healthy leave balance and avoiding negative values in the system?,2061
Why do I have a negative leave balance?,2061
Can you explain the cause of my negative leave balance?,2061
What is the reason for the negative value in my leave balance?,2061
Why is my leave balance showing as negative in the system?,2061
What could have led to my leave balance going into the negative?,2061
Is there a specific explanation for my leave balance being negative?,2061
Can you provide insights into why I have a negative leave balance?,2061
What actions or factors result in a negative leave balance?,2061
"How did my leave balance become negative, and can you clarify?",2061
"Why is my leave balance in the negative, and what steps can I take to understand this?",2061
Why is my brought forward in negative value?,2062
What could be the reason for my brought forward leave showing a negative value?,2062
Is there a specific policy or condition that caused my brought forward leave to be in the negative?,2062
Could you help me understand why my carried-over leave is displaying a negative value in the system?,2062
I'm unsure why my brought forward leave is in negative. Can you please provide clarification or guidance on this matter?,2062
My brought forward amount is negative.,2062
Why is my brought forward leave negative?,2062
Why do I have a negative brought forward leave value?,2062
My brought forward leave value is displaying a negative value. Can you explain why?,2062
What is the reason behind my negative brought forward leave value?,2062
Can you clarify why my brought forward leave balance is negative?,2062
What might have led to my brought forward leave balance showing a negative value?,2062
Is there a policy or specific circumstance that could explain my negative brought forward leave value?,2062
"Could you provide insights into why my carried-over leave is in the negative, and what actions can be taken?",2062
I'm uncertain about the reason behind my negative brought forward leave value. Can you offer guidance or explanation?,2062
How can I address the negative value displayed in my brought forward leave value?,2062
What steps can I take to rectify my negative brought forward leave value?,2062
"Is there a particular reason for the negative value in my brought forward leave, and how can it be resolved?",2062
Can you explain why my brought forward leave is negative and provide potential solutions?,2062
"Why is my carried-over leave amount displaying a negative value, and what can be done to correct it?",2062
How can I resolve a negative brought forward leave value in the system?,2062
"Is there a process for correcting a negative carried-over leave amount, and can you guide me through it?",2062
Can you explain the consequences of having a negative brought forward leave value?,2062
What actions should I take if my brought forward leave value goes into the negative?,2062
Are there specific conditions that may lead to a negative brought forward leave amount?,2062
Can you provide insights into the reasons behind a negative brought forward leave amount and potential solutions?,2062
How can I avoid having a negative brought forward leave value in the future?,2062
Is there a policy or rule in place that determines when a brought forward leave value can go negative?,2062
Can you clarify if a negative brought forward leave value affects my eligibility for future leave requests?,2062
Are there steps to investigate the reasons for a negative carried-over leave amount?,2062
Can you guide me on how to maintain a positive brought forward leave value and prevent it from going negative?,2062
How frequently should I check my brought forward leave value to avoid it going into the negative?,2062
Can a negative brought forward leave value impact my overall leave entitlement?,2062
"What might be the common causes of a negative brought forward leave amount, and how can they be addressed?",2062
Can you explain the procedures for adjusting or reconciling a negative brought forward leave amount?,2062
Is there a specific threshold at which a brought forward leave amount turns negative?,2062
"What role does the system play in calculating and displaying brought forward leave amount, and could system errors contribute to a negative value?",2062
Can you clarify how long a brought forward leave value remains negative and the process for bringing it back to a positive value?,2062
Are there any circumstances under which a negative brought forward leave balance may be considered acceptable or allowed?,2062
Why is my brought forward leave balance negative?,2062
Can you explain why my carried-over leave is in the negative?,2062
What could be the cause of my negative brought forward leave balance?,2062
Is there a policy or condition that results in negative brought forward leave?,2062
Why does my brought forward leave value show as negative in the system?,2062
I'm confused about why my brought forward leave is negative. Can you provide clarification or guidance?,2062
What's the reason behind my negative brought forward leave balance?,2062
Can you clarify why my carried-over leave balance is displaying a negative value?,2062
How can I address the negative value in my brought forward leave balance?,2062
How do I calculate my actual leave balance?,2063
Can you guide me on how to calculate my actual leave balance?,2063
Could you explain the steps involved in calculating my actual leave balance?,2063
How to calculate my actual leave balance?,2063
What is the process for calculating my real or actual leave balance?,2063
Can you provide guidance on how to calculate my actual leave balance accurately?,2063
Is there a specific formula or method that I can use to calculate my actual leave balance?,2063
Could you walk me through the steps required to calculate my actual leave balance accurately?,2063
What's the procedure for determining my actual leave balance?,2063
Can you outline the steps I should follow to calculate my actual leave balance?,2063
How can I accurately calculate my actual leave balance?,2063
Is there a defined process for calculating my actual leave balance?,2063
Can you provide guidance on calculating my actual leave balance?,2063
What method should I use to compute my actual leave balance?,2063
Do you have any tips for accurately calculating my actual leave balance?,2063
Is there a specific calculation method I should follow to determine my actual leave balance?,2063
Could you explain the process for calculating my actual leave balance in detail?,2063
How do I go about calculating my actual leave balance correctly?,2063
How can I calculate my actual leave balance?,2063
What factors should I consider when calculating my actual leave balance?,2063
Can you provide tips for keeping track of my actual leave balance throughout the year?,2063
Is there software or tools available to help me calculate my actual leave balance?,2063
"How does the system calculate my actual leave balance, and can I trust its accuracy?",2063
Are there any common errors people make when calculating their actual leave balance?,2063
What is the formula to calculate actual leave balance?,2063
Can you explain how to calculate actual leave balance?,2063
Are there any regulations or company policies that affect how I calculate my actual leave balance?,2063
What are the steps to perform my actual leave balance calculation?,2063
Can you provide examples of scenarios where calculating actual leave balance can be complex?,2063
Please show me how my actual leave balance is calculated.,2063
Show me the calculation of my actual leave balance.,2063
What are the ways to calculate my actual leave balance?,2063
Actual leave balance calculation.,2063
Can you clarify the steps in calculating actual leave balance?,2063
How can I calculate my actual leave balance accurately?,2063
How to calculate actual leave balance accurately?,2063
Explain the calculation of actual leave balance.,2063
Are there any exceptions or special cases I should be aware of when calculating my actual leave balance?,2063
Can you guide me on determining my actual leave balance?,2063
What's the process for finding my real leave balance?,2063
How can I accurately figure out my leave balance?,2063
Is there a formula to determine my actual leave balance?,2063
Could you explain the method for calculating my actual leave balance?,2063
What steps should I take to calculate my actual leave balance?,2063
Please show me the calculation for my actual leave balance.,2063
What methods can I use to accurately calculate my actual leave balance?,2063
How to calculate actual leave balance accurately?,2063
Could you clarify the steps for determining my real leave balance?,2063
What's the best approach to compute my actual leave balance?,2063
Is there a recommended method for calculating my actual leave balance accurately?,2063
How do I calculate my balance available?,2064
Can you explain how I can calculate my available leave balance for the year?,2064
What steps should I take to determine the number of available leave days I have remaining?,2064
Is there a specific method to calculate my leave balance available after considering my leave taken and any carryover from the previous year?,2064
Could you guide me on how to find out my available leave balance?,2064
How to calculate the leave balance available?,2064
How is the leave balance available being calculated?,2064
What is my current annual leave balance available?,2064
Could you walk me through the steps required to calculate my annual leave balance available?,2064
Can you explain the process for calculating my available leave balance?,2064
How can I determine the number of leave balance I have available for the year?,2064
What's the formula or method to calculate my available leave balance?,2064
Is there a specific way to find out my leave balance available after accounting for leave taken and carryover?,2064
Could you provide a step-by-step guide on calculating my available leave balance?,2064
What's the calculation used to determine my leave balance available?,2064
How is the available leave balance calculated in our system?,2064
Can you inform me of my current available annual leave balance?,2064
How many annual leave days do I have left in my available balance?,2064
What is the process for calculating my annual leave balance available?,2064
What factors should I consider when calculating my available leave balance?,2064
"Can you provide examples of how to calculate available leave balance for different types of leave, such as annual, sick, or vacation?",2064
Are there any tools or software available to help me calculate my available leave balance more efficiently?,2064
"How do I account for leave accrual, usage, and any carryover when calculating my available leave balance?",2064
What documentation or records should I maintain to support my available leave balance calculations?,2064
Can you explain the importance of accurate available leave balance calculations for leave planning?,2064
How often should I check my available leave balance to ensure I'm using it effectively?,2064
Is there a standard format or template for tracking and calculating available leave balance?,2064
