sentence,label
What are the HR administrator rights and settings within the leave module?,2107
Explain the permissions and configuration settings that HR administrators have in the leave management system.,2107
What can administrators view and configure in the leave module?,2107
Describe the rights and settings that administrator users have related to leave management.,2107
What are the specific permissions and capabilities of administrators in the leave module?,2107
Can you detail the settings and privileges that admin possess in the leave management system?,2107
What configuration options are available to HR administrators for leave management?,2107
How can administrators configure settings in the leave module?,2107
What are the administrative settings available for HR users in the leave module?,2107
"As an HR administrator, what functionalities can I access in the leave management system?",2107
What permissions do administrators have for configuring leave settings?,2107
Can you outline the rights and privileges of HR administrators in the leave module?,2107
What settings and controls can administrators configure for leave?,2107
Describe the capabilities of administrators when it comes to leave management settings.,2107
What actions can HR administrators perform in the leave management system?,2107
Explain the role of HR administrators in configuring leave-related settings.,2107
What customization options are accessible to administrators in the leave module?,2107
What is the extent of HR administrator authority in managing leave settings?,2107
Can you detail the specific configuration rights of HR administrators for leave management?,2107
What functionalities and settings can HR administrators modify in the leave module?,2107
"As an HR administrator, how can I tailor the leave management system to our organization's needs?",2107
What controls and settings are within the purview of HR administrators for leave?,2107
Can you provide insights into the leave-related responsibilities of HR administrators?,2107
What privileges do HR administrators have regarding leave management?,2107
Describe the administrative role of HR users in configuring leave settings.,2107
What are the customization options that HR administrators can access in the leave module?,2107
How can HR administrators set up and manage leave policies within the system?,2107
What tools and features are available for HR administrators to oversee leave-related settings?,2107
What settings can HR admin access in the leave module?,2107
Can you explain the configuration options for HR administrators in leave management?,2107
What are the administrative rights and controls for HR users in the leave module?,2107
Describe the customization features available to HR administrators for leave management.,2107
What can HR administrators do in terms of leave policy configuration?,2107
Can you detail the permissions HR administrators have for leave-related settings?,2107
Explain how HR administrators can set up and manage leave policies within the system.,2107
What are the tools and features provided to HR administrators for leave management?,2107
Describe the role of HR administrators in configuring settings for leaves.,2107
What functionalities do HR administrators have for overseeing leave-related configurations?,2107
"If I am an administrator, what settings can I do in leave module?",2107
Who is my leave approver?,2108
Who is my approver for leave request?,2108
Who is my approver for my leave application?,2108
Who is my approver in leave module?,2108
Leave approver info,2108
Leave approver information,2108
Leave approver details,2108
Leave approver,2108
Who is the leave approver?,2108
Who can approve my leave?,2108
Who should I contact to determine the approver for my leave application?,2108
Can you provide me with the details of my leave approver?,2108
Who is the designated approver for my leave requests?,2108
How can I identify the person responsible for approving my leave application?,2108
Who should I contact to confirm the identity of my leave approver?,2108
Can you provide me with information about my leave approver?,2108
How do I determine who can approve my leave requests?,2108
What is the process for identifying the individual who will approve my leave application?,2108
Who is authorized to approve my leave requests?,2108
How can I access information about my leave approver?,2108
Can you guide me on finding details about the person who will approve my leave application?,2108
Who is authorized to approve my leave request?,2108
Who is responsible for approving my leave requests?,2108
Can you tell me the name of my leave approver?,2108
Who has the authority to approve my leave applications?,2108
I need to know the person designated as my leave approver.,2108
Who is the individual in charge of approving my leave?,2108
Who should I contact to find out who approves my leave?,2108
How can I identify my leave approver?,2108
Who holds the role of approving my leave requests?,2108
What is the name of the person who can approve my leave?,2108
Can you inform me about the identity of my leave approver?,2108
Can you inform me about the identity of my leave approver?,2108
Who has the responsibility of approving my leave application?,2108
Who is my designated leave approver?,2108
Please share the details of my leave approver.,2108
Who holds the position of approving my leave?,2108
Who is the authorized individual to approve my leave requests?,2108
Can you guide me on how to find my leave approver's name?,2108
Who is my designated point of contact for leave approvals?,2108
Who is my designated leave approver?,2108
Who should I contact to find out who approves my leave?,2108
How can I identify my leave approver?,2108
Who holds the role of approving my leave application?,2108
What is the name of the person who can approve my leave?,2108
Who has the responsibility of approving my leave application?,2108
Please share the details of my leave approver.,2108
How many levels of approvers are there for my leave application?,2108
How many levels of approvers are involved in processing my leave application?,2108
Can you provide details on the levels of approvers for my leave application?,2108
Can you share information on the hierarchy of approvers for my leave application?,2108
How many tiers of approvers are there for processing my leave application?,2108
Can you specify the number of levels of approvers for my leave application?,2108
Can you inform me about the hierarchical levels of approvers for my leave application?,2108
How many tiers of approvers are involved in the approval process of my leave application?,2108
Can you share information on the levels of approvers responsible for my leave application?,2108
How many days of advanced leave I could apply for this month?,2118
How many days of advance leave I can apply this month?,2118
My advance leave this month?,2118
How many days of advance leave I have?,2118
I want to apply for advance leave. How many days are available?,2118
Advance leave applicable?,2118
How many days of Advanced Leave can I apply for this month?,2118
Can you provide information on my Advanced Leave balance for this month?,2118
What is the maximum number of days of Advance Leave I can request this month?,2118
How many days of Advance Leave am I eligible for this month?,2118
How many days of advanced leave can I take this month?,2118
What is the maximum limit for advance leave this month?,2118
Can you tell me my available advanced leave days for this month?,2118
How many days of advanced leave am I entitled to in this month?,2118
Is there a specific quota for advanced leave this month?,2118
How many days of advanced leave can I request in this month?,2118
"Can I apply for advanced leave, and if so, what's the maximum duration for this month?",2118
How many days of advanced leave do I have left for this month?,2118
What is the allowable limit for advanced leave in this month?,2118
Can you provide me with information on the advanced leave balance for this month?,2118
What is the maximum duration for advanced leave I can request this month?,2118
How many days of advanced leave am I eligible for in the current month?,2118
What is the allowable limit for advanced leave in this month?,2118
Can you provide me with information on the advanced leave balance for this month?,2118
How many days of advanced leave can I take this month?,2118
Is there a specific quota for advanced leave this month?,2118
How many days of advanced leave can I request in the current month?,2118
"Can I apply for advanced leave, and if so, what's the maximum duration for this month?",2118
How many days of advanced leave do I have left for this month?,2118
Tell me the maximum number of days of advanced leave I can request this month.,2118
What is the maximum limit for advance leave this month?,2118
Can you tell me my available advanced leave days for this month?,2118
How many days of advanced leave am I entitled to in this month?,2118
Am I eligible to apply for advanced leave this month?,2118
Provide details on the advanced leave quota for this month.,2118
What's the advanced leave allowance for this month?,2118
Tell me the advanced leave policy for this month.,2118
Explain the rules for applying for advanced leave in this month.,2118
Can you provide the guidelines for requesting advanced leave this month?,2118
I'd like to know the advanced leave limit for this month.,2118
How many days of advanced leave can I apply for this month?,2118
What's the maximum duration for advanced leave this month?,2118
"Can I apply for advanced leave this month, and if so, how many days are allowed?",2118
Tell me the maximum limit for advance leave in this month.,2118
Am I eligible to apply for advanced leave this month?,2118
What's the advanced leave allowance for this month?,2118
Provide details on the advanced leave quota for this month.,2118
Explain the rules for applying for advanced leave this month.,2118
Can you provide the guidelines for requesting advanced leave this month?,2118
I'd like to know the advanced leave limit for this month.,2118
What are the guidelines for requesting advanced leave this month?,2118
How do I apply for advanced leave for this month?,2118
Can you clarify the procedure for applying for advanced leave this month?,2118
What steps should I follow to apply for advanced leave during this month?,2118
How do the rules for advanced leave application work this month?,2118
Could you explain the process for advanced leave applications this month?,2118
What is the procedure for requesting advanced leave this month?,2118
How can I submit an advanced leave application for this month?,2118
What are the requirements for applying for advanced leave this month?,2118
Can you detail the rules for requesting advanced leave this month?,2118
How to submit my medical cert?,2119
How to submit MC?,2119
What is submission of MC?,2119
How to submit MC?,2119
Where can I submit medical certificate?,2119
What is the process for submitting a Medical Certificate (MC)?,2119
Can you guide me on how to submit my Medical Certificate?,2119
"How do I go about applying for an MC, and where should I submit it?",2119
What steps do I need to follow to provide my Medical Certificate to the company?,2119
Is there a specific platform or system for submitting my Medical Certificate?,2119
How do I upload my medical certificate?,2119
Where can I upload my MC?,2119
Where can I upload my medical certificate?,2119
What's the procedure for submitting a medical certificate?,2119
Can you explain how to submit my Medical Certificate online?,2119
How can I share my Medical Certificate with the company?,2119
Is there an online portal for submitting my Medical Certificate?,2119
What are the steps to electronically submit my medical certificate?,2119
How can I digitally submit my MC to the company?,2119
Can you provide instructions on the online submission of my Medical Certificate?,2119
Where should I go to upload my Medical Certificate?,2119
How do I go about submitting my MC?,2119
What is the procedure for medical certificate submission?,2119
Can you guide me on submitting my medical certificate?,2119
Where should I send my medical certificate?,2119
Is there a specific location to submit my medical certificate?,2119
How can I share my medical certificate with the company?,2119
What are the steps to electronically submit my medical certificate?,2119
Where can I upload my MC online?,2119
Is there an online portal for medical certificate submission?,2119
How can I digitally submit my MC to the company?,2119
What's the process for submitting a medical certificate?,2119
Can you explain how to submit my medical certificate digitally?,2119
How can I provide my medical certificate to the company?,2119
Where should I go to upload my medical certificate online?,2119
What platform or system should I use to submit my medical certificate?,2119
Can you provide instructions on submitting my medical certificate online?,2119
What steps do I need to follow to submit my medical certificate to the company?,2119
Is there a dedicated channel for medical certificate submission?,2119
How to apply for an MC and where to submit it?,2119
How can I access the submission page for my Medical Certificate?,2119
Where do I find the option to submit my MC?,2119
What's the process for navigating to the MC submission page?,2119
Can you guide me on how to get to the MC submission portal?,2119
How do I reach the section where I can submit my Medical Certificate?,2119
Is there a specific link or button to submit my MC?,2119
What's the procedure for accessing the MC submission platform?,2119
Where should I go on the website to submit my Medical Certificate?,2119
How can I navigate to the page for submitting my MC?,2119
Is there a menu or tab for MC submissions in INet?,2119
I want to submit MC.,2119
Can I apply for sick leave for yesterday's absence?,2123
"I received MC email reminder yesterday which informed me I didn't apply MC, can I apply the MC now?",2123
"I forget to apply leave for my absence yesterday, can I apply now?",2123
Can I apply for retroactive medical leave?,2123
Can I apply MC for previous absence?,2123
I forgot to request sick leave for my absence yesterday; can I still apply for it now?,2123
Can I submit a retroactive sick leave request for yesterday's absence?,2123
"I received a reminder about my medical certificate yesterday, and I forgot to apply for it. Can I apply for it now?",2123
Is there a way to apply for sick leave after the fact for an absence that occurred yesterday?,2123
Can I request sick leave for an absence that took place yesterday?,2123
I missed applying for sick leave for yesterday. Can I still submit a request now?,2123
Is it possible to apply for sick leave retroactively for yesterday's absence?,2123
I received a reminder about my medical certificate for yesterday. Can I apply for sick leave now?,2123
"Can I request sick leave for an absence that occurred yesterday, even though I forgot to apply for it on time?",2123
I forgot to apply for sick leave for yesterday's absence. Can I still apply for it today?,2123
Can I submit a late sick leave request for an absence that happened previously?,2123
Is there a way to request sick leave for an absence from yesterday?,2123
I didn't apply for sick leave for yesterday's absence. Can I apply for it now?,2123
Can I retroactively apply for sick leave for an absence that occurred previously?,2123
I missed applying for sick leave for yesterday. Can I submit the request now?,2123
Can I apply for sick leave retroactively?,2123
Is it possible to request medical leave after the fact?,2123
Can I submit a late medical leave request?,2123
I forgot to request medical leave for a past absence; can I still apply for it?,2123
Is there a way to apply for medical leave after the fact?,2123
Can I request medical leave for a previous day's absence?,2123
I missed applying for medical leave for a past absence; can I still submit a request?,2123
Can I retroactively apply for medical leave?,2123
Is there a process for requesting medical leave for a past date?,2123
I didn't apply for medical leave for a past absence; can I apply for it now?,2123
Can I submit a late request for medical leave?,2123
Is it possible to apply for medical leave for a previous day's absence?,2123
I forgot to request medical leave for a prior absence; can I still apply for it?,2123
Can I request medical leave for a date in the past?,2123
I missed the deadline for applying for medical leave; can I still do it?,2123
Is there a way to request medical leave for a day that has already passed?,2123
I received a reminder about my medical certificate for a past absence; can I apply for medical leave now?,2123
Can I retroactively request medical leave for an absence that occurred in the past?,2123
Is it possible to apply for medical leave after the fact for a past absence?,2123
I didn't apply for medical leave for a previous day; can I still submit the request?,2123
Can I apply for medical leave after the fact?,2123
Is it possible to request retroactive medical leave?,2123
I missed the deadline for applying for medical leave; can I still do it?,2123
Can I submit a late request for medical leave?,2123
Is there a way to request medical leave for a day that has already passed?,2123
I received a reminder about my medical certificate for a past absence; can I apply for medical leave now?,2123
Can I retroactively request medical leave for an absence that occurred in the past?,2123
Is it possible to apply for medical leave after the fact for a past absence?,2123
I didn't apply for medical leave for a previous day; can I still submit the request?,2123
Can I request medical leave for a date in the past?,2123
Is May 1st a holiday?,2149
Is 02 July a company holiday?,2149
Do I need to work on 02 July?,2149
Is tomorrow a company holiday?,2149
Tomorrow do I need to come to work?,2149
Please help me check whether tomorrow is a company holiday?,2149
02/02/2022 company got open?,2149
Do I have to work on July 2nd?,2149
Is tomorrow a scheduled company holiday?,2149
Do I need to report to work tomorrow?,2149
Is May 1st considered a holiday?,2149
Is July 2nd a designated company holiday?,2149
Will I be required to work on July 2nd?,2149
Is tomorrow an official company holiday?,2149
Do I have to come to work tomorrow?,2149
Can you check if tomorrow is a company holiday?,2149
"Was the company open on February 2nd, 2022?",2149
Is working on July 2nd mandatory?,2149
Is tomorrow listed as a company holiday?,2149
Am I expected to be present at work tomorrow?,2149
Is May 1st an official holiday for the company?,2149
Is July 2nd considered a company holiday?,2149
Do I need to work on July 2nd?,2149
Is tomorrow designated as a company holiday?,2149
Do I have to come to the office tomorrow?,2149
Can you help me verify if tomorrow is a company holiday?,2149
"Was the company open on February 2nd, 2022?",2149
Is working on July 2nd mandatory for employees?,2149
Is tomorrow listed as an official company holiday?,2149
Am I expected to be present at work tomorrow?,2149
Is May 1st a non-working day for the company?,2149
Is July 2nd an observed company holiday?,2149
Will the office be open on May 1st?,2149
Is July 2nd a recognized holiday for the company?,2149
Should I plan to work on July 2nd?,2149
Is tomorrow on the list of company holidays?,2149
Is there a requirement to attend work tomorrow?,2149
Can you check if tomorrow is an official company holiday?,2149
"Was the company operating on February 2nd, 2022?",2149
Is working on July 2nd compulsory?,2149
Is May 1st a company holiday?,2149
Will the office be closed on July 2nd?,2149
Do I need to work on May 1st?,2149
Is July 2nd an official holiday for the company?,2149
Is tomorrow a non-working day?,2149
Can you check if July 2nd is a company holiday?,2149
Is it mandatory to work on May 1st?,2149
Is the office open on July 2nd?,2149
Is tomorrow considered a company holiday?,2149
Is July 2nd a recognized holiday?,2149
How much should I deduct from my salary for each day of unpaid leave?,2150
Show the amount of salary deduction for unpaid leave,2150
How is my unpaid leave calculated?,2150
How is unpaid leave calculated?,2150
How does system calculate the deduction of unpaid leave from my salary?,2150
How is the deduction for each day of unpaid leave calculated?,2150
Can you explain the formula used to calculate salary deductions for unpaid leave?,2150
How much is the deduction from my salary for each day of unpaid leave?,2150
Can you provide the specific amount deducted from my salary for unpaid leave?,2150
What's the formula for calculating salary deductions due to unpaid leave?,2150
Explain the calculation used to determine the deduction for unpaid leave from my salary.,2150
How can I calculate the exact salary reduction for a day of unpaid leave?,2150
Is there a standard rate for salary deductions related to unpaid leave?,2150
What's the method for determining the deduction amount for each day of unpaid leave?,2150
Can you clarify the process for calculating unpaid leave deductions from my salary?,2150
What factors are considered when determining the salary deduction for unpaid leave?,2150
Where can I find information about the deduction amount for unpaid leave in my paycheck?,2150
What's the total deduction from my salary for my unpaid leave days?,2150
Show me the deduction amount for unpaid leave from my salary.,2150
Can you provide details on how my unpaid leave deduction is calculated?,2150
How much will my salary be reduced for each day of unpaid leave?,2150
Explain the calculation method for my salary deduction due to unpaid leave.,2150
What's the specific formula used to determine my unpaid leave deduction?,2150
How does the system calculate the total deduction for my unpaid leave?,2150
What factors contribute to the calculation of unpaid leave deductions from my salary?,2150
Is there a standard rate for the deduction from my salary for unpaid leave?,2150
Can you clarify the process for determining unpaid leave deductions from my salary?,2150
Where can I find information about the total deduction for unpaid leave in my paycheck?,2150
How can I calculate the exact salary reduction for my unpaid leave days?,2150
Is there a fixed amount deducted from my salary for each day of unpaid leave?,2150
What's the standard method for calculating salary deductions related to unpaid leave?,2150
What elements are considered when calculating the salary deduction for unpaid leave?,2150
Please provide the specific amount deducted from my salary for my unpaid leave.,2150
Can you explain how my unpaid leave deduction is computed?,2150
What is the process for determining the salary deduction for unpaid leave days?,2150
Is there a predefined formula for calculating the salary deduction for unpaid leave?,2150
How can I check the total deduction for unpaid leave on my salary statement?,2150
What's the total deduction for my unpaid leave on my salary?,2150
Can you show me the deduction on my paycheck for unpaid leave?,2150
How much will my salary be reduced due to unpaid leave?,2150
Explain the total deduction for my unpaid leave days on my salary statement.,2150
What's the exact amount deducted from my salary for unpaid leave?,2150
How is my salary deduction calculated for unpaid leave?,2150
What factors contribute to the total deduction for unpaid leave on my salary?,2150
Is there a fixed total deduction for unpaid leave in my paycheck?,2150
Where can I find information about the total deduction for unpaid leave on my salary?,2150
how to withdraw my applied leave,2151
how do i withdraw my leave,2151
how to withdraw leave,2151
how to withdraw leave application,2151
how to withdraw my leave application,2151
can I withdraw my leave application,2151
Is it possible to withdraw my leave request?,2151
What is the procedure for withdrawing a leave application?,2151
Can I change my mind about my planned leave and withdraw it?,2151
How do I revoke or retract my previously submitted leave request?,2151
I need to withdraw my leave application; what steps should I follow?,2151
Is there a way to revoke a leave request I previously submitted?,2151
How can I withdraw my leave application?,2151
Can I retract a leave request I've already submitted?,2151
What's the process for withdrawing a leave request?,2151
Is it possible to change my mind and withdraw my leave application?,2151
Can you guide me on how to withdraw my submitted leave?,2151
How do I withdraw my leave request?,2151
Is there a way to withdraw a leave application after it has been approved?,2151
I need to withdraw my leave; what should I do?,2151
Can you help me with the steps to withdraw my leave request?,2151
What's the procedure for leave application withdrawal?,2151
How can I withdraw my leave application that hasn't been approved yet?,2151
Is it possible to withdraw a leave request that hasn't been approved?,2151
What steps should I follow to withdraw my unapproved leave application?,2151
Can I change my mind and withdraw my pending leave application?,2151
How do I withdraw a leave request that's still pending approval?,2151
What's the process for revoking a leave application that hasn't been approved?,2151
Is there a way to retract a leave request that's not yet approved?,2151
"Can you guide me on how to withdraw my leave request, which is still pending?",2151
I submitted a leave application but want to withdraw it before it's approved. How?,2151
