sentence,label
Could you explain how to create day codes?,2188
What are the steps involved in generating day codes?,2188
How can I add new day codes or update existing ones?,2188
Is there a procedure for generating day codes that I should follow?,2188
What's the method for generating day codes in the system?,2188
How can I create day codes in the system?,2188
Can you guide me on generating day codes?,2188
I'd like to know the steps for adding new day codes or updating existing ones. Can you help?,2188
What's the procedure for generating and managing day codes?,2188
How do I go about generating day codes for different purposes?,2188
"Is there a way to customize day codes, and if so, how?",2188
What's the process for generating unique day codes?,2188
Please explain how I can generate day codes for specific use cases.,2188
Can you provide insights into the day code generation process?,2188
How do I manage day codes effectively in the system?,2188
How can I navigate to generate a day code?,2188
Where can I find the option to generate day codes?,2188
Could you guide me to the day code generation feature?,2188
How do I access the tool for generating day codes?,2188
What steps should I follow to initiate day code generation?,2188
Where in the system can I go to generate day codes?,2188
Is there a specific menu or section to create day codes?,2188
Can you show me how to navigate to the day code generation tool?,2188
What's the location in the system for generating day codes?,2188
"I'd like to generate a day code, where do I start?",2188
How can I enter the day code generation interface?,2188
Is there a tab or option to begin generating day codes?,2188
What's the path to generating day codes in the system?,2188
Can you provide instructions on how to reach the day code generation page?,2188
Where can I access the feature to generate day codes?,2188
"I want to generate a day code, where should I go in the system?",2188
How do I navigate to create a new day code?,2188
Can you direct me to the tool for generating day codes?,2188
What's the route to reach the day code generation screen?,2188
How can I find the option to generate a unique day code?,2188
How do I access the day code generation feature?,2188
Where can I find the tool to generate day codes?,2188
What's the process for reaching the day code generation page?,2188
"I'd like to generate a day code, where do I start?",2188
Can you show me how to navigate to the day code generation tool?,2188
Where in the system can I go to generate day codes?,2188
Is there a specific menu or section to create day codes?,2188
"I want to generate a day code, where should I go in the system?",2188
What's the route to reach the day code generation screen?,2188
Earn leave basis / entire leave entitlement,2189
how i earn my leave?,2189
explain how Earn Leave Basis and Entire Leave Entitlement system work for leave accrual,2189
difference between Earn Leave Basis and Entire Leave Entitlement,2189
could you clarify how Earn Leave Basis and Entire Leave Entitlement methods apply to our leave entitlement?,2189
How does the Entire Leave Entitlement method differ from the Earn Leave Basis in terms of leave accrual?,2189
What are the key distinctions between the Earn Leave Basis and Entire Leave Entitlement approaches to leave accrual?,2189
Please clarify the mechanics of leave accrual in the Earn Leave Basis system.,2189
Can you outline the process of accruing leave under the Entire Leave Entitlement system?,2189
Can you elaborate on how leave is earned under the Earn Leave Basis system?,2189
Can you explain the concept of earning leave on the basis of work done?,2189
How does the Earn Leave Basis method work in terms of leave accrual?,2189
Could you provide a detailed explanation of the Entire Leave Entitlement system for leave accrual?,2189
What's the difference between earning leave based on work done and having the entire leave entitlement upfront?,2189
Can you clarify the distinction between the Earn Leave Basis and Entire Leave Entitlement systems for leave accrual?,2189
Please describe how leave accrual is calculated in the Earn Leave Basis method.,2189
How does the Entire Leave Entitlement approach affect an employee's leave accrual?,2189
Can you explain the process of accruing leave under the Entire Leave Entitlement system?,2189
What are the practical implications of using the Earn Leave Basis for leave accrual?,2189
Could you elaborate on how the Entire Leave Entitlement method impacts leave accrual and utilization?,2189
Can you explain the different methods of leave entitlement?,2189
What are the available options for leave entitlement?,2189
How does leave entitlement work?,2189
Could you provide information about the methods of leave entitlement?,2189
What are the types of leave entitlement methods employees can choose from?,2189
Can you clarify the leave entitlement options available to employees?,2189
"I'd like to learn more about the various leave entitlement methods, can you help?",2189
How are leave entitlements structured in our company?,2189
What's the policy regarding leave entitlement methods?,2189
Can you describe the different approaches to leave entitlement?,2189
Please explain the methods by which employees can access leave entitlement.,2189
What's the difference between the methods of leave entitlement?,2189
Can you provide an overview of the leave entitlement methods currently in place?,2189
How can employees select their preferred leave entitlement method?,2189
"I'm interested in understanding the options for leave entitlement, can you elaborate?",2189
Could you outline the choices for leave entitlement methods within our organization?,2189
What are the key features of the leave entitlement methods offered to employees?,2189
Can you provide details about the leave entitlement methods available in our company?,2189
How do employees decide which leave entitlement method to use?,2189
"I'd like to know more about the various methods of leave entitlement in our company, can you provide information?",2189
How does the leave entitlement method work?,2189
What are the different leave entitlement methods available?,2189
Can you explain the options for leave entitlement methods?,2189
What's the policy regarding leave entitlement methods?,2189
I'd like to understand the various methods of leave entitlement,2189
How can employees choose their preferred leave entitlement method?,2189
Tell me about the leave entitlement methods offered to employees.,2189
What are the key features of our leave entitlement methods?,2189
Please outline the choices for leave entitlement methods.,2189
How do employees decide which leave entitlement method to use?,2189
why user do not have leave entitlement,2191
why EMP001 doesn't entitled AL,2191
"I do not see my leave entitlement, why is that?",2191
Why does some employees do not have leave entitlement?,2191
"If I do not see my leave entitlement, what could be the reason?",2191
What could be the reason behind certain employees not having leave entitlement?,2191
Is there a specific criterion that determines an employee's eligibility for leave entitlement?,2191
Are there circumstances under which an employee may lose their leave entitlement?,2191
Can you explain the process of how leave entitlement is determined for employees?,2191
Are there any common factors that might lead to an employee not having leave entitlement?,2191
Why is there no leave entitlement for certain users?,2191
EMP002 has no annual leave entitlement; can you explain why?,2191
I'm unable to find my leave entitlement. Why might an employee not have leave entitlement?,2191
What factors could result in an employee not having annual leave entitlement?,2191
Can you shed light on why some employees may lack leave entitlement?,2191
What criteria are used to determine whether an employee is eligible for leave entitlement?,2191
Can you clarify why certain employees do not possess leave entitlement?,2191
Under what circumstances can an employee lose their leave entitlement?,2191
How is leave entitlement calculated for employees?,2191
Are there specific conditions or rules that can lead to an absence of leave entitlement for an employee?,2191
Why do some employees not receive leave entitlement?,2191
Could you explain why EMP003 doesn't have any leave entitlement?,2191
I cannot find my leave entitlement; what could be the explanation for this?,2191
Are there specific cases where employees may not be entitled to leave?,2191
What factors determine an employee's eligibility for leave entitlement?,2191
Is there a situation where an employee might lose their leave entitlement?,2191
Why don't I see any leave entitlement for EMP004?,2191
EMP005 appears to lack leave entitlement; is there a reason for this?,2191
What criteria are used to decide if an employee should have leave entitlement?,2191
Can you provide insights into why some employees might not have leave entitlement?,2191
Could you clarify why certain users do not have leave entitlement?,2191
Under what circumstances can an employee lose their entitlement to leave?,2191
How is leave entitlement typically determined for employees?,2191
Are there specific conditions that lead to the absence of leave entitlement for certain employees?,2191
I'm curious about why EMP006 has no leave entitlement; can you explain?,2191
What are the common factors that result in an employee not having leave entitlement?,2191
Is there a process or calculation used to determine leave entitlement for employees?,2191
Can you shed light on why some employees do not possess leave entitlement?,2191
Could you outline the reasons behind not having leave entitlement as an employee?,2191
What rules or conditions might lead to an absence of leave entitlement for employees?,2191
Why do I not have leave entitlement?,2191
Can you explain why EMP007 doesn't possess leave entitlement?,2191
I cannot find my leave entitlement; what might be the reason?,2191
What factors determine whether an employee has leave entitlement?,2191
Is there a specific criterion for not having leave entitlement?,2191
Why is there no leave entitlement for certain employees?,2191
Why doesn't EMP008 have any leave entitlement?,2191
Could you clarify why some users lack leave entitlement?,2191
Are there conditions under which an employee might lose their leave entitlement?,2191
How is leave entitlement typically determined for employees?,2191
I cannot apply Annual Leave. Annual Leave not in the selection list.,2193
I cannot find the leave type/code that I want to apply,2193
why is my leave application type is not in the selection list,2193
i cannot select my leave application type,2193
What should I do if I'm unable to see the option to apply for Annual Leave in the selection list?,2193
Is there a specific reason why the leave type or code I want to apply for is missing from the options?,2193
Can you explain why my entitled leave application type is not in the selection list?,2193
Are there any troubleshooting steps I can take if I cannot select my preferred leave application type?,2193
How can I resolve the issue of not being able to find the Annual Leave option when applying for leave?,2193
What might be causing the absence of the leave type I need in the application list?,2193
Why is the option to apply for Annual Leave not available in the selection list?,2193
I cannot seem to find the leave type I want to apply for. What should I do?,2193
My leave application type is different from what I expected. Can you explain why?,2193
What could be the reason behind the inability to select my preferred leave application type?,2193
How can I address the issue of Annual Leave not being in the selection list when applying for leave?,2193
Why might the leave type or code I need be missing from the list of options?,2193
Is there a specific procedure to follow if my leave application type appears incorrect?,2193
What steps should I take if I cannot find the leave type I want to apply for?,2193
Can you provide guidance on resolving the issue of not being able to select the desired leave application type?,2193
Are there common factors that lead to the absence of certain leave types in the application list?,2193
I'm unable to find the Annual Leave option in the selection list. What should I do?,2193
Why is Annual Leave not listed as an option when I try to apply for leave?,2193
What could be causing the absence of the Annual Leave type in the selection list?,2193
I cannot select the leave type I need for my application. Why is that?,2193
Why is my preferred leave type missing from the selection list when I apply for leave?,2193
"I expected to see Annual Leave in the selection list, but it's not there. Can you help?",2193
My leave application type appears to be different. Can you explain why this might be happening?,2193
I cannot find the option to apply for Annual Leave. What should I do to resolve this?,2193
What troubleshooting steps can I follow if I'm unable to select my desired leave type?,2193
How can I address the issue of Annual Leave not being available for selection?,2193
The leave type I want to apply for is missing from the options. Why is this happening?,2193
Can you clarify why my leave application type has changed unexpectedly?,2193
I'm having trouble selecting my leave application type. Any suggestions on what to do?,2193
Why is my leave application type different from what I expected?,2193
What might be causing the absence of the leave type I need in the application list?,2193
Why is the option to apply for Annual Leave not visible in the selection list?,2193
I cannot find the leave type I want to apply for. Can you guide me on resolving this?,2193
My leave application type seems incorrect. What could be the reason behind this?,2193
Why am I unable to select my preferred leave application type? Any insights?,2193
Are there common factors that lead to certain leave types not appearing in the application list?,2193
Why is my leave type missing from the selection list?,2193
I cannot find the leave option I want to apply for. What's happening?,2193
Why isn't my leave type in the selection list?,2193
I'm unable to select my desired leave type. Can you assist?,2193
What should I do if the leave type I need is not in the selection list?,2193
My leave application type is not available for selection. Why?,2193
How can I resolve the issue of my leave type not being in the selection list?,2193
Why isn't the leave type I want to apply for visible in the selection list?,2193
Can you explain why I cannot see my leave type in the selection list?,2193
"Why has my leave type changed, and it's not in the selection list anymore?",2193
why I not able apply leave even I have leave earn,2194
why cannot apply leave even I have balance,2194
why I cannot apply leave even though I still have leave balance,2194
Why I cannot submit my leave applications?,2194
cannot apply leave,2194
"Despite having accrued leave, why am I unable to submit a leave application?",2194
What could be the reason for not being able to apply for replacement leave even though I have a balance?,2194
reason I unable to apply leave,2194
Is there a known issue causing difficulties in submitting my leave applications?,2194
Why is it that I cannot apply for leave at the moment?,2194
"I have earned leave, but I cannot seem to submit a leave application. What could be the issue?",2194
Why am I facing difficulties in applying for replacement leave despite having a balance?,2194
What are the possible reason of unable to apply leave although im sure that I have enough balance?,2194
I am unable to submit my leave applications; is there a specific problem that's causing this?,2194
Is there a known issue or system error preventing me from applying for leave?,2194
"Despite having accumulated leave, why cannot I submit my leave application?",2194
Why am I experiencing problems when trying to apply for replacement leave even though I have leave balance?,2194
Can you clarify the employment act's provisions regarding the minimum leave entitlement for employees?,2194
What steps should I take if I cannot submit my leave applications despite having leave entitlement?,2194
Why is the system not allowing me to apply for leave at this time?,2194
"I have earned leave, but I cannot seem to submit my leave application. What could be the issue?",2194
Why cannot I apply for leave even though I have accrued leave days?,2194
"Despite having leave earned, I'm facing difficulties in submitting my leave application. What could be the reason?",2194
What might be preventing me from applying for leave despite having leave entitlement?,2194
I cannot submit my leave applications despite having leave balance. Is there a known issue causing this?,2194
"Why is it that I cannot apply for leave at the moment, even though I have leave earned?",2194
"Despite accumulating leave, why am I unable to submit my leave application?",2194
"What's preventing me from applying for leave, even though I have accrued leave days?",2194
"I cannot apply for leave, despite having balance. Is there a specific problem causing this?",2194
"Why am I experiencing issues when trying to apply for leave, despite having leave entitlement?",2194
"I've earned leave, but I cannot submit my leave applications. What should I do?",2194
Is there a system error or known issue causing problems when I attempt to apply for leave?,2194
"Despite having leave earned, I cannot seem to submit my leave application. What's happening?",2194
"I'm unable to apply for leave, even though I have accrued leave days. What might be the issue?",2194
What could be preventing me from applying for leave when I have leave earned?,2194
"I have earned leave, but I cannot submit my leave application. Are there any known issues?",2194
"Why am I facing difficulties in applying for leave, despite having earned leave?",2194
"Despite accumulating leave, I cannot submit my leave applications. Is this a known issue?",2194
"What should I do if I cannot apply for leave, despite having leave entitlement?",2194
"Why is the system not allowing me to apply for leave, even though I have earned leave?",2194
Why cannot I apply for leave even though I have earned leave?,2194
"I have leave balance, but I cannot submit my leave application. What's wrong?",2194
"Despite having leave entitlement, I cannot seem to apply for leave. What's happening?",2194
What could be preventing me from applying for leave when I have leave earned?,2194
"I've earned leave, but the system won't let me submit my leave application. Why?",2194
"Why am I facing difficulties in applying for leave, even though I have accrued leave?",2194
Is there a known issue preventing me from applying for leave despite having leave balance?,2194
"I have earned leave, but I'm unable to submit my leave application. Any insights?",2194
"Despite having leave earned, I cannot apply for leave. What might be the issue?",2194
"What should I do if I cannot apply for leave, even though I have leave entitlement?",2194
why I unable take leave even I have leave earn,2194
why cannot take leave even I have balance,2194
why I cannot take leave even though I still have leave balance,2194
cannot take leave,2194
"Despite having accrued leave, why am I unable to apply leave?",2194
What could be the reason for not being able to take for replacement leave even though I have a balance?,2194
reason I unable to take leave,2194
Is there a known issue causing difficulties in apply my leave?,2194
Why is it that I cannot take leave at the moment?,2194
Why am I facing difficulties in submitting for replacement leave application despite having a balance?,2194
What are the possible reason of unable to take leave although im sure that I have enough balance?,2194
Is there a known issue or system error preventing me from taking leave?,2194
Why am I experiencing problems when trying to take replacement leave even though I have leave balance?,2194
Why is the system not allowing me to take leave at this time?,2194
Why cannot I take leave even though I have accrued leave days?,2194
What might be preventing me from taking leave despite having leave entitlement?,2194
"Why is it that I cannot take leave at the moment, even though I have leave earned?",2194
"What's preventing me from taking leave, even though I have accrued leave days?",2194
"I cannot take leave, despite having balance. Is there a specific problem causing this?",2194
"Why am I experiencing issues when trying to take leave, despite having leave entitlement?",2194
Is there a system error or known issue causing problems when I attempt to take leave?,2194
"I'm unable to take leave, even though I have accrued leave days. What might be the issue?",2194
What could be preventing me from taking leave when I have leave earned?,2194
"Why am I facing difficulties in taking leave, despite having earned leave?",2194
"What should I do if I cannot take leave, despite having leave entitlement?",2194
"Why is the system not allowing me to take leave, even though I have earned leave?",2194
Why cannot I take leave even though I have earned leave?,2194
"Despite having leave entitlement, I cannot seem to take leave. What's happening?",2194
What could be preventing me from taking leave when I have leave earned?,2194
"Why am I facing difficulties in taking leave, even though I have accrued leave?",2194
Is there a known issue preventing me from taking leave despite having leave balance?,2194
"Despite having leave earned, I cannot take leave. What might be the issue?",2194
"What should I do if I cannot take leave, even though I have leave entitlement?",2194
Please explain to me the different leaves in Malaysia law.,2195
How many leaves are there in Malaysian law? Please explain the definition of each.,2195
"Under the Employment Act, what are the leave that employees are entitled to?",2195
"What is minimum annual leave entitlement for employees in Malaysia, and how does it vary based on duration of employment?",2195
Can you explain different types of leave that Malaysian employee are entitled to under Employment Act 1955?,2195
"What is the duration of maternity leave for female employees in Malaysia, and is it paid?",2195
Could you provide an overview of the various types of leaves mandated by Malaysian labor laws and their definitions?,2195
"In Malaysian law, how many types of leaves exist, and can you elaborate on the specific definitions for each?",2195
"What are the leave entitlements for employees in Malaysia according to the Employment Act, and could you explain each type?",2195
"I'm curious about the minimum annual leave entitlement for Malaysian employees. Does it differ depending on their length of employment, and if so, how?",2195
"How many types of leaves are specified in Malaysian labor laws, and what are their respective definitions?",2195
"Under the Employment Act of Malaysia, what are the different types of leave that employees can avail, and what are the definitions of these leaves?",2195
Can you provide details about the minimum annual leave entitlement for employees in Malaysia and explain how it varies based on their length of employment?,2195
"What is the duration of maternity leave for female employees in Malaysia, and is it paid under the Employment Act?",2195
"Please give an overview of the leave entitlements for Malaysian employees as mandated by the Employment Act, and provide explanations for each type.",2195
"How many categories of leave are there in Malaysian employment law, and can you elaborate on the specific definitions for each category?",2195
"In Malaysian labor laws, what types of leave are available to employees, and what do they encompass according to the Employment Act?",2195
Could you explain the different types of leave that Malaysian employees are entitled to under the Employment Act of 1955?,2195
"What are the leave provisions for Malaysian workers under the Employment Act, and are there variations in entitlements based on employment duration?",2195
"Can you clarify the annual leave entitlement for employees in Malaysia and outline any differences depending on their length of service, as prescribed by the Employment Act?",2195
Could you explain the different leaves mandated by the Employment Act in Malaysia?,2195
What are the minimum leave entitlements according to the Malaysian Employment Act?,2195
I'd like to understand the leave provisions outlined in the Employment Act in Malaysia. Can you explain?,2195
"What types of leaves are specified under the Employment Act in Malaysia, and what are the minimum entitlements?",2195
Can you provide details on the minimum leave entitlements for employees in Malaysia as per the Employment Act?,2195
"What is the minimum annual leave entitlement for employees in Malaysia, and does it vary based on employment duration?",2195
Please explain the various types of leaves required by the Malaysian Employment Act and their definitions.,2195
"Under the Employment Act in Malaysia, what are the specific leave entitlements for employees?",2195
Could you outline the leave entitlements for Malaysian employees as per the Employment Act?,2195
"In Malaysia, how many types of leaves exist under the Employment Act, and what do they encompass?",2195
"What are the minimum annual leave entitlements for Malaysian employees, and how do they change with employment duration?",2195
Can you clarify the different types of leaves mandated by the Malaysian Employment Act of 1955?,2195
"What types of leave are available to Malaysian employees under the Employment Act, and how are they defined?",2195
