 idx,sentence,label
1,How to calculate my entitlement of leave?,2000
2,How many AL entitled?,2000
3,How many ML entitled?,2000
4,How many RL entitled?,2000
5,What is my AL entitlement?,2000
6,What is my ML entitlement?,2000
7,What is my RL entitlement?,2000
8,What is my Annual Leave entitlement?,2000
9,What is my Replacement Leave entitlement?,2000
10,What is my Medical Leave entitlement?,2000
11,How can I check my leave entitlement in the system?,2000
12,Where can I view all my leave entitlements at once?,2000
13,How is my leave entitlement calculated according to my employment contract?,2000
14,Can I get details on how my leave entitlements are determined?,2000
15,What are my leave entitlements for the year?,2000
16,"If I have questions about my leave entitlements, who should I contact?",2000
17,Does my leave entitlement change based on how long I’ve been with the company?,2000
18,How do I navigate to the page that shows my leave entitlements?,2000
19,Where can I find information about my leave balance and entitlements?,2000
20,Can I see a breakdown of my leave entitlements on the platform?,2000
21,Is there a way to see all my leave entitlements in one place?,2000
22,How do I know how much leave I am entitled to this year?,2000
23,Can I view my leave entitlements for multiple leave types at once?,2000
24,How to calculate my entitlement for Emergency Leave?,2000
25,How to calculate my entitlement for Annual Leave?,2000
26,How to calculate my entitlement for Medical Leave?,2000
27,What is my total leave?,2000
28,Can I check my leave entitlements for next year in the system?,2000
29,How do I find out if my leave entitlements have changed this year?,2000
30,Where can I view a summary of all my leave entitlements for the current year?,2000
31,How to calculate my emergency leave entitlement?,2001
32,EL entitled,2001
33,EL entitlement,2001
34,How to calculate my EL entitlement?,2001
35,Emergency Leave entitlement,2001
36,Emergency Leave entitled,2001
37,How to calculate my emergency leave entitlement?,2001
38,How many days of Emergency Leave can I apply for in a year?,2001
39,How many days of EL can I apply for in a year?,2001
40,Is there a limit on the number of Emergency Leave days I can take?,2001
41,Is there a specific entitlement for Emergency Leave in my company?,2001
42,Is there a specific entitlement for EL in my company?,2001
43,What happens if I run out of Annual Leave but need to take Emergency Leave?,2001
44,What happens if I run out of AL but need to take EL?,2001
45,What are the conditions under which I can apply for Emergency Leave?,2001
46,What are the conditions under which I can apply for EL?,2001
47,Are there any specific rules governing the use of Emergency Leave?,2001
48,Are there any specific rules governing the use of EL?,2001
49,Are there any exceptions to the limit on Emergency Leave days?,2001
50,How do I know if I’ve reached my limit for Emergency Leave days?,2001
51,How do I know if I’ve reached my limit for EL days?,2001
52,Is Emergency Leave tracked separately from other leave types in the system?,2001
53,How do I check my remaining Emergency Leave days?,2001
54,How do I check my remaining EL days?,2001
55,How is Emergency Leave recorded in the HR system?,2001
56,Can I apply for Emergency Leave multiple times in a year?,2001
57,Can I apply for EL multiple times in a year?,2001
58,How is my total EL entitlement calculated for the year?,2001
59,Number of EL entitled,2001
60,Total of EL entitlement,2001
61,What attachment needed if I want to apply MC?,2002
62,What attachment required if I want to apply MC?,2002
63,What attachment needed if I want to apply Medical Leave?,2002
64,What attachment required if I want to apply Medical Leave?,2002
65,What I need attach to apply MC?,2002
66,What I need attach to apply Medical Leave?,2002
67,What attachment needed if I want to take MC?,2002
68,What attachment required if I want to take MC?,2002
69,What attachment needed if I want to take Medical Leave?,2002
70,What attachment required if I want to take Medical Leave?,2002
71,What I need attach to take MC,2002
72,What I need attach to take Medical Leave,2002
73,What attachment needed if I want to submit application for MC,2002
74,What attachment required if I want to submit application for MC,2002
75,What attachment needed if I want to submit Medical Leave application,2002
76,What attachment required if I want to submit Medical Leave application,2002
77,What I need attach to submit application for MC,2002
78,What I need attach to submit Medical Leave application,2002
79,what is the reason my applied leave still show pending status,2026
80,what could be the possible reasons for my applied leave to still be showing as pending,2026
81,reason of my applied leave still in pending,2026
82,What could be the reason for my leave application to remain in a pending status?,2026
83,Could you elaborate on the specific reason my leave application is pending?,2026
84,What factors contribute to leave applications being placed in a pending status?,2026
85,Are there any common reasons that leave applications tend to be in a pending status?,2026
86,Can you provide more details about the reason for my leave application being in pending status?,2026
87,What is the reason my applied leave not yet approved?,2026
88,Reason of leave still in pending,2026
89,What causing my leave application still in pending status?,2026
90,What could be the reason for my leave application to remain in a pending status?,2026
91,Is there a specific reason for my leave application to remain pending?,2026
92,"What could be causing the delay in the approval of my leave application, leaving it in a pending status?",2026
93,My leave has not been approved yet; can you provide an explanation?,2026
94,What is the reason of my leave application in pending status?,2026
95,Can you explain the reasons behind my leave application still being pending?,2026
96,What factors contribute to leave applications remaining in a pending status?,2026
97,What is the specific reason for my leave application being stuck in a pending status?,2026
98,What might be the possible reasons for my leave application to still be pending?,2026
99,What's the reason my leave application hasn't been approved yet?,2026
100,Could you explain why my applied leave is still pending?,2026
101,Is there a specific reason for my leave request to be pending?,2026
102,What factors are causing my leave application to remain in pending status?,2026
103,How can I find out why my leave application is still pending?,2026
104,How to cancel applied leave?,2027
105,Is it possible to cancel a leave request once it's submitted?,2027
106,What steps do I need to take to cancel an approved leave request?,2027
107,"Is it feasible to cancel an applied leave, and how should I proceed?",2027
108,How to cancel leave?,2027
109,How I cancel my leave application?,2027
110,How do I cancel my leave applications?,2027
111,I want cancel leave.,2027
112,"I want cancel leave, how?",2027
113,What should do if I want to cancel leave?,2027
114,How do I cancel the approved leave?,2027
115,I want to cancel my leave application?,2027
116,Can you guide me on the process to cancel an applied leave?,2027
117,Is there a specific deadline for cancelling a leave application once it's submitted?,2027
118,How to cancel a leave request that has already been approved?,2027
119,What is the process of cancelling a leave application?,2027
120,What action required to cancel an approved leave application?,2027
121,What do I need to do to cancel my applied leave?,2027
122,Where can I perform leave cancellation within the company?,2027
123,Can you provide me with the steps to follow to cancel my leave application?,2027
124,How can I cancel a leave request that I've already submitted?,2027
125,Is there a way to retract or cancel a leave application after it's been submitted?,2027
126,What is the procedure if I want to cancel an approved leave request?,2027
127,Can I cancel my leave application if I no longer need it?,2027
128,How do I go about cancelling a leave application that has already been approved?,2027
129,"Is it possible to cancel my leave request, and if so, what are the steps involved?",2027
130,Can you explain the process for cancelling a leave application?,2027
131,"I need to cancel my leave; what should I do?",2027
132,How do I initiate the cancellation of a leave request?,2027
133,Can you guide me on how to cancel my approved leave?,2027
134,What steps should I follow to cancel my leave request?,2027
135,What is the steps to cancel a leave application?,2027
136,How should I formally request the cancellation of my leave?,2027
137,Can I cancel my leave application even if it's already in the approval process?,2027
138,Could you explain the procedure to cancel a leave request?,2027
139,What should I do for leave cancellation?,2027
140,Please teach me how to perform leave cancellation.,2027
141,"Can I cancel my leave application online, or is it done through HR?",2027
142,How quickly can a leave request be canceled once initiated?,2027
143,How do I navigate to cancel an approved leave application?,2027
144,Can you guide me on how to find the option to cancel an approved leave?,2027
145,Where can I go to cancel my approved leave application?,2027
146,How can I access the option to cancel my approved leave?,2027
147,What's the process for navigating to cancel an approved leave?,2027
148,Could you explain how to find the cancellation option for approved leaves?,2027
149,Can you direct me to the page where I can cancel my approved leave?,2027
150,How to cancel approved leave?,2027
151,Is it possible to retract approved leave?,2027
152,Can I initiate the process to cancel previously approved leave?,2027
153,Am I allowed to undo leave that has already been approved?,2027
154,Is there a way to cancel leave that has been officially approved?,2027
155,Can I use the system to cancel approved leave?,2027
156,Am I permitted to revoke previously approved leave using the system?,2027
157,Is it within policy to cancel leave that has already been formally approved?,2027
158,Can I withdraw leave that has been officially approved?,2027
159,How do I cancel leave that has already been approved through the proper channels?,2027
160,Is it acceptable to use the formal process to retract approved leave?,2027
161,Can I formally request to cancel previously approved leave?,2027
162,Am I within my rights to retract leave that has been formally approved?,2027
163,Is there a formal procedure for canceling approved leave?,2027
164,Can I cancel leave that has been approved through the proper channels?,2027
165,Am I allowed to initiate the process to cancel leave that has been officially approved?,2027
166,Is it within the rules to retract leave that has been formally approved?,2027
167,Can I use the system to formally cancel leave that has already been approved?,2027
168,Am I permitted to cancel previously approved leave using the application system?,2027
169,Is it possible to cancel leave that has been officially approved through the system?,2027
170,How can I cancel the leave I applied last week?,2027
171,Can I cancel my leave application?,2027
172,Is it possible for me to cancel my leave application?,2027
173,Can you guide me on the steps to cancel my leave application?,2027
174,How to cancel my leave application?,2027
175,Where can I cancel my leave application?,2027
176,How can I cancel my leave application?,2027
177,"I want to cancel my leave application. Can you provide guidance?",2027
178,I want to cancel my leave application?,2027
179,Please help cancel my leave.,2027
180,Can you please help me to cancel my upcoming leave application?,2027
181,"I want to cancel my leave application, please help me.",2027
182,Help me cancel applied leave?,2027
183,Can you cancel leave for me?,2027
184,Help me cancel my applied leave for tomorrow?,2027
185,Please assist me to cancel my leave.,2027
186,Can you help me cancel my upcoming leave application?,2027
187,I need to cancel my leave application. Can you help with this?,2027
188,I'd like to cancel my leave. Can you assist with that?,2027
189,"Can you assist me in cancelling my leave, please.",2027
190,Please help me cancel my upcoming leave application.,2027
191,Can you assist with cancelling my applied leave?,2027
192,Could you please cancel my leave for tomorrow?,2027
193,I need help to cancel my leave. Can you assist me?,2027
194,Can you assist me in the process of leave cancellation?,2027
195,I'd like to cancel my leave. Can you help me with the cancellation?,2027
196,Is it possible for you to cancel my leave application?,2027
197,Please provide assistance in cancelling my leave.,2027
198,Can you please cancel my leave?,2027
199,I'd like to cancel my upcoming leave application. Can you assist?,2027
200,"Help me cancel my leave application, please.",2027
201,I want to cancel my applied leave. Can you assist with that?,2027
202,Please assist me to cancel my leave.,2027
203,Can you help me cancel my upcoming leave application?,2027
204,I need to cancel my leave application. Can you guide me through the process?,2027
205,Is it possible for you to cancel my leave?,2027
206,I'd like to cancel my leave. Can you provide guidance?,2027
207,Can you assist with cancellation of my applied leave?,2027
208,Could you please cancel my leave for tomorrow?,2027
209,I need help to cancel my leave. Can you assist me?,2027
210,Can you guide me through the process of my upcoming leave application cancellation?,2027
211,"I'd like to cancel my leave. Can you help me with the cancellation?",2027
212,Is there a way for you to cancel my leave application?,2027
213,Please provide assistance in cancellation of my leave.,2027
214,I want to cancel my leave application. Can you help me with that?,2027
215,"Can you assist me in cancelling my leave, please.",2027
216,I need to cancel my upcoming leave. Can you guide me through it?,2027
217,Help me cancel my applied leave for tomorrow?,2027
218,Can you cancel my leave for me?,2027
219,I'd like to cancel my leave. Can you assist?,2027
220,Is it possible for you to perform leave cancellation on my behalf?,2027
221,Please provide assist to cancel my leave.,2027
222,I need help canceling my leave. Can you assist with that?,2027
223,Can you guide me through the process of cancellation of my leave?,2027
224,I want to cancel my applied leave. Can you help with that?,2027
225,"Help me with the cancellation of my leave application, please.",2027
226,I need to cancel my upcoming leave. Can you guide me through it?,2027
227,Please assist in performing leave cancellation on my behalf.,2027




